registered_date,devices,title,question,answers
2024-09-13 11:08:00,자유 게시판,중국서버 K100 도어락,"안녕하세요간단히 질문먼저 드리겠습니다!IOT 준비중으로 입문단계라 지식이 좀 부족해서 이것저것 여쭤보려합니다!​애플홈킷(애플tv) + 주요제품들 아카라 + 일부 다른제품(스위치등) 이렇게 준비중이예요가격압박으로 T2다운라이트 및 각종 센서류를 중국직구 하려고 합니다.​근데 추후엔 K100 도어락 G4도어벨까지 생각은 하고 있는데요.K100을 사용하려면 중국서버는 사용할수 없다고 하시더라구요..​관련 내용으로 검색하다 보니 허브를 먼저 중국에 연결하고 직구제품들을 붙인 후 홈킷등록 하고 서버 변경하면아카라앱에서는 지워지지만 홈킷에는 남게되어 홈킷 자동화로 사용하면 된다는 글을 보게 되었습니다.​제가 찾아보고 이해한게 맞을까요?​직구제품 - t2다운라이트, 재실/모션 센서정발제품 - m3허브, k100, g4도어벨​이렇게 구매해서 위와같은 방법으로 홈킷 등록하여 사용할 수 있는게 맞을까요?​왠지 질문이 두서없는것 같지만 ㅠ 이해하셨을거라 믿고 ㅠ",허브를 하나 더 사서 K100과 G4는 국내서버에 붙이시면 됩니다. 홈킷으로 넘어와서 홈킷에서 제어하시면 됩니다.그외는 중국서버로 사용하셔도 됩니다 제가 이런 방식으로 사용하고 있습니다. | 그렇군요! 허브 하나만으로 운용하는 방법은 없고 추가하는 수 밖엔 없을까요? ㅠ | 그렇게 하면 한쪽은 펌웨어 업데이트를 할 수 없습니다. 허브 하나 더 추가하는 걸 추천합니다. | 아 그런 단점이 있군요! 감사합니다 많은 도움 되었습니다
2024-09-13 10:37:00,팁&노하우 공유,K100 도어락 RF송수신기 월패드와 연결 방법(삼성SDS 월패드 / SHN-8610),"문의가 꽤 여러번 있어서절대 적인 것은 아니지만 비슷한(?)모델 사용자분들이 참고 하시면 될 것 같아서 참고 자료 겸 작성 해 봅니다..​K100 도어락을 월패드에서 열수 있게 해주는RF송수신기 연결 팁(?)입니다​참고로 삼성SDS 월패드 / SHN-8610 입니다.같은 회사 제품이라도 타 모델에서는 다를 수 있으니..참고만 해주세요​1 (RED) : 12V2 (BLACK) : GND3 (BROWN) : 접점(+)​X (BROWN) : 접점(-)  <- 해당선은 월패드와 연결 하지 않았습니다.​* 혹시 모르니 월패드 전원은 꼭 내리고 작업하세요



 














​","상세한 설명 너무너무 감사합니다ㅠㅠ!!그런데 혹시 보드에서 2,3번 선 옆 노란색 선은 어떤건가요..? | 어디로 연결되는건지 확인은 안해봤지만
송수신기랑 연결된 선은 아니에요~ | 넵 감사합니다!!!!! 정말 큰 도움이 되었습니다"
2024-09-13 09:56:00,카메라/도어벨,도어벨 G4  상시전원 컨버터 연결,"풍성하고 행복한 한가위 보내세요^^​도어벨 G4 그냥 건전지로 사용하려고 했는데 상시전원 자료 찾아보다 할 수 있겠다는 생각에 온통 머리속은 상시전원 연결하는 것으로 가득하네요.​마지막 관문까지 온 것 같습니다. 컨버터 설치해야 한다고 해서 컨버터에 대해 알아봤는데 크기가 작아야 한다고 해서 알리에서 주문하려고 하는데 아카라라이프에서도 부자재로 판매하고 있더라구요.



 














이 컨버터를 어떻게 연결하는지가 문제네요. G4에 저 두선을 연결하면 될까요. 기존 도어벨에 연결됐던 GND DC12V을 오른쪽 선에 연결하면 되는 걸까요?​월패드 뒤에 컨버터를 연결해야 된다고 하시는 분도 계시던데, 컨버터는 어디에 연결해야 하나요?​이 질문이 마지막 질문이 됐으면 하는 바람을 가지고 질문합니다.​기존 도어벨 사진입니다



 

























​추가질문입니다] 기존 도어벨에 연결됐던 4선 중 2선은 전원 연결하고 나머지 2선은 와고커넥터로 전선처리를 하면 될까요.","도어벨과 월패드 사이에 연결된 전선이 UTP 케이블과 같은 얇은 DC전선이라면 월패드 쪽에 DC 컨버터를 설치하고, (DC전선에 AC220V 전원을 연결하면 AC 220V전원의 허용 규격보다 DC전선이 얇기때문에 화재 우려가 있습니다.) 도어벨과 월패드 사이에 연결된 전선이 일반적인 굵은 AC 전선이라면 동일거리에서 DC 5V보다 AC 220V 전선의 전압강하가 적기때문에 도어벨쪽에 DC 컨버터를 설치하는 것이 좋습니다.올려주신 DC컨버터 사진을 보면 컨버터 왼쪽선이 AC전원, 오른쪽선이 도어벨에 연결되는 DC전원측입니다.히카와님의 도어벨 환경을 보면 기존 도어벨에 연결된 전선이 일반적인 AC전선이기 떄문에 도어벨에 연결하는 것이 좋습니다. | 감사합니다^^ 마지막 질문을 명확하게 설명해주셔서 정말 고맙습니다. 컨버터 왼쪽에 있는 2개선을 월패드와 연결된 4개선 중에 2개선을 연결하면 되는건가요. 컨버터 오른쪽에 있는 선을 G4에 연결하는 거네요. | 아래와 같은 순서로 작업하시면 됩니다.1. 월패드 전원으로 사용되는 AC 220V 전원선을 분기 (배선차단기를 내리고 작업)2. 월패드-도어벨간 연결된 월패드쪽 4선을 월패드에서 분리 후, 분리된 4선 중 2선을 220V 전원의 분기된 선에 연결3. 도어벨쪽 4선 중 2번 작업에 사용된 동일한 색상의 2선을 DC 컨버터의 AC입력측 2선에 연결4. DC 컨버터의 DC출력측 2선을 G4도어벨의 외부전원단자에 연결 | 감사합니다^^ 후니워니 님 설명 중에 1, 2 번을 이해를 잘 안 되서 하나 더 질문드리겠습니다. 1, 2번을 실행하려면 거실에 있는 월패드를 분해해서 작업을 해야 할까요. 전원선을 분기 하라고 하셨는데 분기의 뜻이 무엇인가요? | 전원선 분기는 1선을 2선으로 나누어 사용하는 Y커넥터를 생각하시면 됩니다. 보통  1:2 와고(wago) 커넥터 2개나 2:4 1개를 이용하여 전원선을 2개로 분기합니다(1개 전원은 기존 월패드 전원용, 나머지 1개 전원은 G4도어벨 상시전원을 위한 DC 컨버터 입력전원용) | 정말 고맙습니다^^ 전원선 분기는 와고 커넥터를 이용하면 되는군요. 아직도 이해 안 되는 게 도어벨에서 컨버터를 연결하는데 전원선이 없는데 어떻게 해야 하나요. 기존 도어벨에 연결된 GND, DC12V 선이 전력선인 줄 알았는데 후니워니 님 설명을 보면 전원선이 아니라고 하는 것 같아서 .... 제가 이해가 안 되는 부분입니다. | 그림이 더 나을 것 같아서 기존 도어벨 구성도와 DC컨버터를 이용한 G4도어벨 구성도를 그렸습니다. 참고하시기 바랍니다. | 감사합니다^^ 이해가 확실히 됐습니다.  저도 그림을 그려봤는데 이렇게 안되고 월패드에서 전원선을 가지고 와야 하는군요. 그럼 거실에서 전원선을 도어벨까지 보내야겠네요. 이건 전기공사 하시는 분들 불러야 가능하겠네요. | 12V DC컨버터(아답터, SMPS, 안정기)는 AC(교류) 220V전원을 DC(직류) 12V 전원으로 변환하는 역할을 합니다.따라서 DC컨버터 입력측에는 AC 220V 가 연결되어야 하고 DC컨버터 출력측에는 DC12V가 연결되어야 합니다.히카와님이 그리신 그림에는 DC 컨버터 입력측에 AC 220V가 아닌 월패드의 DC 12V 전원(상시전원 아님)이 연결되기 때문에 G4에 DC12V 전원을 공급할 수 없습니다.전기공사를 추가로 할 필요없이 기존 월패드에 연결된 AC220V 전원을 분기해서 사용하면 됩니다.그렇게 어려운 작업이 아니기때문에 별도의 전기공사없이 1:2와고 커넥터 2개만 있으면 되고 작업할때 현관에 있는 메인차단기나 전열용 차단기를 내리고 작업하면 됩니다. | 확실하게 이해했습니다. AC 220V 전원선이 도어벨 쪽에는 없으니 월패드를 분해해서 전원선을 분기해야 하는군요. 그런데 전원선을 분기해서 분기한 전원선을 컨버터에 연결하려면 그 전원선을 도어벨 있는 현관까지 가지고 와야 하지 않나요. 그 작업이 쉽지 않아 보이는데 이 부분 제가 잘 못 이해한 걸까요. 월패드에서 전원선만 분기하면 전원선을 가지고 안 와도 기존에 있던 2개선으로 제가 그렸던 것처럼 연결해도 되는 걸까요?후니워니 님이 설명해주신 1. 월패드 전원으로 사용되는 AC 220V 전원선을 분기 (배선차단기를 내리고 작업)2. 월패드-도어벨간 연결된 월패드쪽 4선을 월패드에서 분리 후 4선 중 2선을 220V 전원의 분기된 선을 연결3. 도어벨쪽 4선 중 2, 2-1번 작업에 사용된 동일한 색상의 2선을 DC 컨버터의 AC입력측 2선에 연결4. DC 컨버터의 DC출력측 2선을 G4도어벨의 외부전원단자에 연결이제 이해가 됩니다. 감사합니다. 풍성하고 행복한 한가위 보내세요 | 히카와님께서 인용한 제 댓글에 오타가 있었네요..^^;;;;   수정하였습니다.히카와님도 행복한 명절 보내시기 바랍니다. | 월패드에서 분기하시고 컨버터를 월패드 뒤에 넣으실텐데...컨버터의 L N 과 월패드 전원선  220V 결합2. 월패드 4선 랜선을 분리 후 2선을 컨버터 + - 연결하셔야합니다. 220V 연결하시면 펑 합니다.3. 도어벨 쪽 랜선은 이미 DC 컨버터와 연결 되어있습니다.4. 이미 연결된 랜선 2선을 G4 외부전원 단자 (극성상관없음)에 연결"
2024-09-13 07:24:00,아카라/ IoT 뉴스,"[정보]
                                
                                

                                
                                
                                    
                                    스마트폰 바탕화면에 아카라홈 대시보드 만들기!","최근에 처음 발견한 기능이 있는데 유용하여 공유합니다 :) ​제목처럼 바로 스마트폰 바탕화면에 아카라홈 대시보드를 추가하는겁니다.​각설하고 바로 화면 공유하겠습니다​



 







 



전 안드로이드 유저라 제 폰 기준입니다 ^^​1. 우선 아이콘 길게 클릭한 후 우측 ""위젯"" 클릭​2. 원하는 대시보드 선택종류는 아래 2가지 입니다.- 4개의 카드를 추가 가능한 4*2 사이즈- 8개의 카드 추가 가능한 4*4 사이즈



 




























Previous image
Next image





 



3. 위젯 설정추가하고자 하는 장치 상태 확인, 장치 제어, 동시실행을 선택합니다. 카메라 영상 등은 없네요.​저는 자주 사용하는 카드로 8개 꽉꽉 채워 만들어봤습니다.



 




























Previous image
Next image





 



4. 완성!이제 스마트폰 바탕화면에 대시보드가 생성되었네요



 


















 



홈앱에서도 대시보드 구성은 가능하지만 사실  그 버튼 몇 번 더 누르는 행위가 있어야하죠 ㅎㅎ 앱을 찾고 들어가서 로딩을 기다린 후, 대시보드를 뒤적거리며 눌러야하는 행위도 사실 귀찮습니다.​하지만 내 방 조명처럼 간단하고 자주 사용할 수 있는 기능은 위젯으로 만들어버리면, 휴대폰을 하다가 바탕화면에서 쉽게 제어가 가능하니 사용성이 더 편하네요!​참고하시면 좋을것 같아 공유해봅니다 



 









 



​​",
2024-09-12 21:01:00,카메라/도어벨,도어벨 상시 전원 연결,"드디어 기존 도어벨 제거에 성공했습니다저희집은 결선이 간단하게 돼 있습니다  4개의 선이 있는데 전원선은 1개  2개가 있어야 G4에 연결할 수 있는거 아닌가요



 














음성  GND  DC12V  영상   입니다  ​어느선을 연결하면 될까요?​



 














​","dc 12, gnd요 | 감사합니다^^ 상시전원 드디어 할 수 있네요 | 2번 3번인데 이건 보통 도어벨울려야 전원공급되서리 컨버터 별도로 다셔야할거예요 | 감사합니다^^ 컨버터에 대해 알아봐야겠네요. | 월패드 뒤에 벽 함에 들어가는 컨버터가 많지 않습니다. 초소형 구매하셔야해요. | 감사합니다^^ 컨버터를 도어벨 뒤에 연결하는게 아니라 월패드 뒤에 연결 해야 하는건가요. | 도어벨에 220볼트는 없으실거에요.요비선이라는걸 이용해서 도어벨 함에서 월패드 뒤로 220볼트 선을 넣어야 도어벨쪽에 컨버터를 달 수 있는데 힘들죠. 기존 랜선도 꿈쩍안해서 거의 불가능에 가깝습니다.월패드 뒤에서 월패드로 연결된 220v를 분기하여 컨버터를 달고 기존 랜선 4선중 2선을 컨버터와 연결 도어벨쪽 2선 g4와 연결 이리하시면 됩니다. | 감사합니다^^ 월패드에서 220V 전원 분기하는걸 이제야 이해했습니다. 월패드 분해해보면 또 궁금한것들이 생길 것 같네요. | 제가 글 준비하고 있으니 참고하시면 될거같습니다 | https://cafe.naver.com/aqara/10701"
2024-09-12 20:16:00,자유 게시판,"[가입인사]
                                
                                

                                
                                
                                    
                                    안녕하세요!!",안녕하세요~~,안녕하세여~ | 반갑습니다.
2024-09-12 16:20:00,자유 게시판,이제 입문하는데요 중국서버? 한국서버?,"내년 새로 이사할 집을 iot로 꾸미려 준비하며 공부중입니다.​조명공사할때 T2 다운라이트를 넣으려고 해요. 그런데 정발 가격이 후덜덜 하더라구요..​타오바오에서는 정발가격의 거의 반가격이던데요..그래서 필요한 모든 제품들을 타오바오에서 직구하는게 좋겠다 생각이 들었어요.​그럼 아예 모든 제품을 중국서버로 연결하고 시작하면 될까요? (일단은 조명 자동화가 주여서 t2 다운라이트, 재실, 문열림센서 정도만 사용하게 될것 같아요)​중국서버로 했을때 단점이 있나요? (자동화 속도가 느려진다던가요)","그럼 중국서버로 시작하는 것도 나쁘지는 않을거 같아요.자동화 속도는 보통 로컬로 진행되기 때문에 큰 영향은 없을 거 같고,단점이라면 한국 정발 제품이 안 물릴 수 있는 경우가 있는데.. 그것도 구입할때 글로벌 제품으로 구입하면 물리는데 전혀 문제가 없습니다.장점도 있습니다. 앞서 언급한대로 가격도 싸고 제품군도 훨씬 다양합니다. | 답변감사합니다 😊 | 저도 T2다운라이트 정발되기전에 구매해서 중국서버 사용중이고 
다른 제품들은 허브포함 전부 정발판인데
아직 문제가 생긴적은 없습니다 | 오 그렇군요! 감사합니다 !"
2024-09-12 14:05:00,카메라/도어벨,부착된 도어벨 제거 방법,"도어벨을 양면테이프로 부착하려고 했다가 나사못으로 고정하려고 합니다. 기존에 있던 도어벨을 제거 하고 그 자리에 하려고 하는데 기존에 있던 도어벨 해체 방법을 알수가 없네요. 그냥 힘으로 위 아래로 하면 빠질까요?기존 도어벨은 코맥스입니다.



 














G4는 옆에 나사 풀고 아래로 내리면 되던데, 기존에 있는 코맥스는 어떻게 해야 할 지 모르겠는데 아시는 분 계시면 도움을 주시면 감사하겠습니다.","찾았습니다^^ 아래쪽에 나사가 있나보네요. | 알고 나면 모든게 쉽게 생각되는게 세상 이치인가봅니다. 모를땐 엄청 힘들었는데 알고 나니, 진짜 쉽네요. 도어벨 사진을 보면 누르는 벨 아래 작은 동그라미 안에 나사가 있네요. 고무 파킹을 빼면 나사가 보입니다."
2024-09-12 10:21:00,카메라/도어벨,도어벨 G4 부착,질문1) 도어벨 G4의 무게감이 있던데 제품 뒷면에 있는 양면테이프로 잘 붙을까요? 나사못으로 하지 않아도 괜찮을까요?​​,양면테이프 덕지덕지 발라도 대가리가 무거워서 흘러내립니다. ㅠ.ㅠ그냥 나사못으로 박는게 좋아요. | 감사합니다^^ 양면테이프로 깔끔하게 될 줄 알았는데 나사못으로 고정해야겠네요 | 상시로 하면 충분히 붙더라구요 | 감사합니다^^ 상시로 하셨다는 것은 상시전원 하셨다는 말인가요. 저도 상시전원 해보려고 하는데 쉽지가 않네요 | 저는 양면테이프로만 붙였는데 잘 부착되어 있습니다. | 감사합니다^^ 기존 도어벨를 제거하고 그 자리에 부착해 상시전원까지 하려고 합니다. 양면테이프가 깔끔하긴 한데 혹시 떨어질까봐 걱정이 되서 나사못으로 하려고 합니다
2024-09-12 09:20:00,자유 게시판,"[가입인사]
                                
                                

                                
                                
                                    
                                    안녕하세요 반갑습니다.","안녕하세요, 겨울 이사를 앞 두고 IoT 로 최소 조명, 전동커튼 정도는 연동해서 사용하고자 계획하고 있습니다. ​의견나누고 배우고자 가입하였습니다. ^^",와~ 리모델링 하시나봅니다. 잘 꾸미셔요! | 반갑습니다~
2024-09-11 23:11:00,자유 게시판,"[가입인사]
                                
                                

                                
                                
                                    
                                    안녕하세요!",실생활에  사용해볼려고 공부 중입니다.,반갑습니다~~~
2024-09-11 22:48:00,자유 게시판,"[가입인사]
                                
                                

                                
                                
                                    
                                    안녕하세요~~~","안녕하세요,​한달전 쯤 K100 설치하고 잘 쓰다가엇그제부터 상태가 좀 이상해서 검색하다이 카페에 들어오게 되었네요​잘 부탁드립니다~~~준파 드림",반겁습니다. | 반갑습니다 ㅅ.ㅅ | 안녕하세여 | 안녕하시오 | 반갑습니다!
2024-09-11 21:11:00,자유 게시판,"[가입인사]
                                
                                

                                
                                
                                    
                                    반갑습니다.",오늘 제품 설치하고 카페 가입했습니다.잘 부탁드립니다.,반갑습니다~~~ | 안녕하세요~
2024-09-11 19:51:00,카메라/도어벨,G4 상시전원 질문드립니다…,"검색 많이해보고 DC12V 컨버터, 멀티미터까지 준비했는데 감이 안오네요 ㅠㅠ 두번째 사진에서 인터폰(코콤 KVM-604)에는 황,적에 연결 돼있고 세번째 사진 도어벨(코콤 KC-C10)에는 4개 연결돼있었습니다. 상시전원 가능할까요? ㅠㅠ","1. 인터폰 전원 On상태에서 인터폰 수화기를 들지 않고 도어벨의 2,3번 단자(황,적)의 나사머리에 멀티미터(DCV로 설정)의 검칭봉을 대고 12V가 나오는지 확인하시기 바랍니다.2. 12V가 지속적(최소 2분 이상)으로 나온다면 DC12V 컨버터 필요없이 도어벨에 2,3번 단자에 연결되어 있는 황색, 녹색선을 G4도어벨의 외부전원단자에 극성 구분없이 연결하면 됩니다.3. 12V가 나오지 않는다면 두번째 사진의 왼쪽 굵은 흰색선이 AC220V 전원선이므로 이 전원선을 분기하여 (배선차단기 내리고 작업) DC12V 컨버터의 입력단자에 연결하고 인터폰의 황색, 녹색선을 빼서 DC12V 컨버터에 출력단자에 연결한 뒤 2번 작업과 같이 도어벨 2,3번 단자에 연결되어 있는 황색, 녹색선을 G4 도어벨 외부전원단자에 연결합니다. | 와우 자세한 설명 감사드립니다! 퇴근후 해볼게요!! | 감사합니다!! 허접히지만 결국 연결은 했습니다. 감사합니다!!!🥹 | 작업하시느라 고생 많으셨습니다. 아카라에서 G4부자재로 판매하는 DC컨버터로 연결하셨군요..DC 컨버터와 배선을 인터폰 뒷쪽 공간에 넣을 수 있으면 조금 깔끔해질 것 같습니다. | 그 공간이 너무 조그만 해서 그 안에 넣을 수가 없었어요 🥹 깔끔하게 마무리 할 방법을 생각해 봐야 될 것 같아요! | 도어벨쪽 뒷쪽 공간도 인터폰 뒤쪽 공간과 동일 크기인가요? 만약에 동일한 크기라면 소형 DC컨버터를 구매해서 인터폰 뒤쪽이나 도어벨 뒤쪽에 넣으시기 바랍니다.https://cafe.naver.com/aqara/6283"
